{
  "schema_version": 1,
  "campaign_id": "active-bytes-v1-qwen-core-btop64",
  "seed": 20270807,
  "defaults": {
    "model": "Qwen/Qwen2.5-7B-Instruct",
    "model_id": "qwen2p5-7b",
    "model_revision": "a09a35458c702b33eeacc393d103063234e8bc28",
    "weight_dtype": "bf16",
    "tensor_parallel_size": 1,
    "pipeline_parallel_size": 1,
    "requested_api_output_tokens": 129,
    "unmetered_bootstrap_tokens_per_request": 1,
    "metered_decode_tokens_per_request": 128,
    "temperature": 0,
    "ignore_eos": true,
    "prefix_cache": false,
    "speculative_decode": false,
    "cpu_kv_offload": false,
    "swap": false,
    "power_limit_w": 700,
    "minimum_decode_seconds_per_repeat": 30,
    "repetitions": 5
  },
  "blocks": [
    {
      "block_id": "qwen-fit",
      "split": "coefficient-fit",
      "axes": {
        "context_tokens": [4096, 8192, 16384],
        "kv_cache_dtype": ["bf16", "fp8_e4m3"],
        "target_batch": [4, 32]
      }
    },
    {
      "block_id": "qwen-calibration",
      "split": "residual-calibration",
      "axes": {
        "context_tokens": [4096, 8192, 16384],
        "kv_cache_dtype": ["bf16", "fp8_e4m3"],
        "target_batch": [16]
      }
    },
    {
      "block_id": "qwen-evaluation",
      "split": "evaluation",
      "axes": {
        "context_tokens": [4096, 8192, 16384],
        "kv_cache_dtype": ["bf16", "fp8_e4m3"],
        "target_batch": [8, 64]
      }
    }
  ]
}
