{
  "schema_version": 1,
  "campaign_id": "active-bytes-v1-pilot",
  "seed": 20270806,
  "defaults": {
    "model": "Qwen/Qwen2.5-7B-Instruct",
    "model_id": "qwen2p5-7b",
    "model_revision": "PIN_BEFORE_PILOT",
    "weight_dtype": "bf16",
    "tensor_parallel_size": 1,
    "pipeline_parallel_size": 1,
    "requested_api_output_tokens": 129,
    "unmetered_bootstrap_tokens_per_request": 1,
    "metered_decode_tokens_per_request": 128,
    "temperature": 0,
    "ignore_eos": true,
    "prefix_cache": false,
    "speculative_decode": false,
    "cpu_kv_offload": false,
    "swap": false,
    "power_limit_w": 700,
    "minimum_decode_seconds_per_repeat": 30,
    "repetitions": 3
  },
  "blocks": [
    {
      "block_id": "pilot",
      "split": "pilot",
      "cells": [
        {"cell_id": "p-a-l4096-b8-bf16", "context_tokens": 4096, "target_batch": 8, "kv_cache_dtype": "bf16"},
        {"cell_id": "p-b-l4096-b8-fp8", "context_tokens": 4096, "target_batch": 8, "kv_cache_dtype": "fp8_e4m3"},
        {"cell_id": "p-c-l16384-b32-bf16", "context_tokens": 16384, "target_batch": 32, "kv_cache_dtype": "bf16"},
        {"cell_id": "p-d-l16384-b32-fp8", "context_tokens": 16384, "target_batch": 32, "kv_cache_dtype": "fp8_e4m3"}
      ]
    }
  ]
}
